send email,(sendEmail)
set the body to the sender,(setFieldFromFieldVal (getProbMutableFieldByFieldName body) (evalField (getProbFieldByFieldName sender)))
set the outgoing email's recipient to sender,(setFieldFromFieldVal (getProbMutableFieldByInstanceNameAndFieldName outgoing_email recipient_list) (evalField (getProbFieldByFieldName sender)))
set the subject to I like this sender,"(setFieldFromString (getProbMutableFieldByFieldName subject) ""I like this sender"")"
set the body to bar time for all,"(setFieldFromString (getProbMutableFieldByFieldName body) ""bar time for all"")"
set the recipient list to myself@myjob.com,"(setFieldFromString (getProbMutableFieldByFieldName recipient_list) ""myself@myjob.com"")"
set the subject of this outgoing email to hello,"(setFieldFromString (getProbMutableFieldByInstanceNameAndFieldName outgoing_email subject) ""hello"")"
set the subject to the sender's email,(setFieldFromFieldVal (getProbMutableFieldByFieldName subject) (evalField (getProbFieldByFieldName sender)))
set I am thinking about the sender as the subject,"(setFieldFromString (getProbMutableFieldByFieldName subject) ""I am thinking about the sender"")"
create tom as a name,"(createInstanceByFullNames name ""tom"")"
create name david,"(createInstanceByFullNames name ""david"")"
create name for david,"(createInstanceByFullNames name ""david"")"
yes,(yes)
ok,(yes)
put this is a test in body,"(setFieldFromString (getProbMutableFieldByFieldName body) ""this is a test"")"
send the email,(sendEmail)
set myself@myjob.com as the recipient,"(setFieldFromString (getProbMutableFieldByFieldName recipient_list) ""myself@myjob.com"")"
set someone@myandyou.com as the recipient,"(setFieldFromString (getProbMutableFieldByFieldName recipient_list) ""someone@myandyou.com"")"
send,(sendEmail)
compose a new email,(createInstanceByConceptName outgoing_email)
create an outgoing email,(createInstanceByConceptName outgoing_email)
create an outgoing email and set the subject to I'm on my way,"(doSeq (createInstanceByConceptName outgoing_email) (setFieldFromString (getProbMutableFieldByFieldName subject) ""I'm on my way""))"
define person!,"(defineConcept ""person"")"
define the concept person,"(defineConcept ""person"")"
define concept person,"(defineConcept ""person"")"
add wings as a field in name,"(addFieldToConcept name ""wings"")"
add email as a field in name,"(addFieldToConcept name ""email"")"
add the email field to the concept name,"(addFieldToConcept name ""email"")"
"create a name, call it bob","(createInstanceByFullNames name ""bob"")"
create a name call it wing,"(createInstanceByFullNames name ""wing"")"
set bob's classification to baba won't you,"(setFieldFromString (getProbMutableFieldByInstanceNameAndFieldName bob classification) ""baba won't you"")"
set bob's classification to bob@gmail.com,"(setFieldFromString (getProbMutableFieldByInstanceNameAndFieldName bob classification) ""bob@gmail.com"")"
what's bob's classification?,(evalField (getProbFieldByInstanceNameAndFieldName bob classification))
what is bob's email?,(evalField (getProbFieldByInstanceNameAndFieldName bob email))
create a name call it jane,"(createInstanceByFullNames name ""jane"")"
take bob's classification,(evalField (getProbFieldByInstanceNameAndFieldName bob classification))
and set it as jane's classification,(setFieldFromFieldVal (getProbMutableFieldByInstanceNameAndFieldName jane classification) (getProbFieldVal))
take bob's classification and set it as jane's classification,(doSeq (evalField (getProbFieldByInstanceNameAndFieldName bob classification)) (setFieldFromFieldVal (getProbMutableFieldByInstanceNameAndFieldName jane classification) (getProbFieldVal)))
set the recipient to be bob's classification,(setFieldFromFieldVal (getProbMutableFieldByFieldName recipient_list) (evalField (getProbFieldByInstanceNameAndFieldName bob classification)))
add nana@gmail.com to the recipient list,"(addToFieldFromString (getProbMutableFieldByFieldName recipient_list) ""nana@gmail.com"")"
set jane's classification to be jane@gmail.com,"(setFieldFromString (getProbMutableFieldByInstanceNameAndFieldName jane classification) ""jane@gmail.com"")"
set bob's classification to be bob2@gmail.com,"(setFieldFromString (getProbMutableFieldByInstanceNameAndFieldName bob classification) ""bob2@gmail.com"")"
set it as the recipient,(setFieldFromFieldVal (getProbMutableFieldByFieldName recipient_list) (getProbFieldVal))
that's it,(end)
create a name my spouse,"(createInstanceByFullNames name ""my spouse"")"
set its classification to my.spouse@gmail.com,"(setFieldFromString (getProbMutableFieldByFieldName classification) ""my.spouse@gmail.com"")"
eat this subject with my spouse,(unknownCommand)
sure,(yes)
take the subject from the email,(evalField (getProbFieldByInstanceNameAndFieldName email subject))
now set it as the outgoing email's subject,(setFieldFromFieldVal (getProbMutableFieldByInstanceNameAndFieldName outgoing_email subject) (getProbFieldVal))
take the body from the incoming email,(evalField (getProbFieldByInstanceNameAndFieldName inbox body))
and set it as the body,(setFieldFromFieldVal (getProbMutableFieldByFieldName body) (getProbFieldVal))
now send the email,(sendEmail)
"that's it, you're done!",(end)
set the outgoing email's recipient to email's sender,(setFieldFromFieldVal (getProbMutableFieldByInstanceNameAndFieldName outgoing_email recipient_list) (evalField (getProbFieldByInstanceNameAndFieldName email sender)))
set the recipient to the email's sender,(setFieldFromFieldVal (getProbMutableFieldByFieldName recipient_list) (evalField (getProbFieldByInstanceNameAndFieldName email sender)))
google,(unknownCommand)
read incoming email,(readInstance (getProbInstanceByName inbox))
next email message,(nextEmailMessage)
read email,(readInstance (getProbInstanceByName email))
read current email,(readInstance (getProbInstanceByName inbox))
read email message,(readInstance (getProbInstanceByName email))
previous email message,(previousEmailMessage)
read name bob,(readInstance (getInstance name bob))
name has a gender,"(addFieldToConcept name ""gender"")"
name has an age,"(addFieldToConcept name ""age"")"
bob's classification is bob@work.com,"(setFieldFromString (getProbMutableFieldByInstanceNameAndFieldName bob classification) ""bob@work.com"")"
bob's classification is identical to jane's classification,(setFieldFromFieldVal (getProbMutableFieldByInstanceNameAndFieldName bob classification) (evalField (getProbFieldByInstanceNameAndFieldName jane classification)))
set bob's classification to jane's classification,(setFieldFromFieldVal (getProbMutableFieldByInstanceNameAndFieldName bob classification) (evalField (getProbFieldByInstanceNameAndFieldName jane classification)))
set subject to I am on my way,"(setFieldFromString (getProbMutableFieldByFieldName subject) ""I am on my way"")"
set body to I wanted to tell you something interesting,"(setFieldFromString (getProbMutableFieldByFieldName body) ""I wanted to tell you something interesting"")"
set body to let me know if you have any questions,"(setFieldFromString (getProbMutableFieldByFieldName body) ""let me know if you have any questions"")"
compose name sam,"(createInstanceByFullNames name ""sam"")"
set next email,(nextEmailMessage)
read the current email,(readInstance (getProbInstanceByName inbox))
next incoming email,(nextEmailMessage)
next inbox,(nextEmailMessage)
set recipient to a@gmail.com b@gmail.com and c@gmail.com,"(setFieldFromString (getProbMutableFieldByFieldName recipient_list) ""a@gmail.com b@gmail.com and c@gmail.com"")"
set the recipient to a@gmail.com b@gmail.com and c@gmail.com and d@gmail.com,"(setFieldFromString (getProbMutableFieldByFieldName recipient_list) ""a@gmail.com b@gmail.com and c@gmail.com and d@gmail.com"")"
set recipient to a@gmail.com b@gmail.com d@gmail.com,"(setFieldFromString (getProbMutableFieldByFieldName recipient_list) ""a@gmail.com b@gmail.com d@gmail.com"")"
set the recipient to b@gmail.com and c@gmail.com and d@gmail.com,"(setFieldFromString (getProbMutableFieldByFieldName recipient_list) ""b@gmail.com and c@gmail.com and d@gmail.com"")"
set the body to your vacation has been approved,"(setFieldFromString (getProbMutableFieldByFieldName body) ""your vacation has been approved"")"
set the body to I didn't hear from you in a while is everything ok,"(setFieldFromString (getProbMutableFieldByFieldName body) ""I didn't hear from you in a while is everything ok"")"
set the subject to working hours this week,"(setFieldFromString (getProbMutableFieldByFieldName subject) ""working hours this week"")"
john is a name,"(createInstanceByFullNames name ""john"")"
create a name for bill and set bill's classification to fdsdf@gmail.com,"(doSeq (createInstanceByFullNames name ""bill"") (setFieldFromString (getProbMutableFieldByFieldName classification) ""fdsdf@gmail.com""))"
set recipient as name jane's classification,(setFieldFromFieldVal (getProbMutableFieldByFieldName recipient_list) (evalField (getFieldFromInstance (getInstance name jane) classification)))
write hello all in the body,"(setFieldFromString (getProbMutableFieldByFieldName body) ""hello all"")"
use bob's classification as the subject,(setFieldFromFieldVal (getProbMutableFieldByFieldName subject) (evalField (getProbFieldByInstanceNameAndFieldName bob classification)))
drive bob's classification to the subject,(unknownCommand)
dive bob's name,(unknownCommand)
eat the subject,(unknownCommand)
split the sender,(unknownCommand)
walk around the email,(unknownCommand)
meet bob,(unknownCommand)
establish the sender,(unknownCommand)
strive to the recipient,(unknownCommand)
pay for the sender,(unknownCommand)
prepare the body,(unknownCommand)
acknowledge the subject,(unknownCommand)
bike to the sender,(unknownCommand)
repair the subject,(unknownCommand)
often remain with the recipient,(unknownCommand)
talk this email to bob,(unknownCommand)
read subject,(unknownCommand)
read name,(unknownCommand)
subject,(unknownCommand)
bob's classification,(evalField (getProbFieldByInstanceNameAndFieldName bob classification))
set bob's classification,(setFieldWithMissingArg (getProbMutableFieldByInstanceNameAndFieldName bob classification))
